{
  "builder_version": "LTMD_U1_VERTICAL_MATERIALIZER_0.1",
  "corpus": {
    "canonical_objects": 492,
    "pages": 86549
  },
  "full_materialization_bytes": 120354,
  "full_materialization_sha256": "e2faab966faced48327634c4acd40a867b76add29612538736b91db8d3afb0ad",
  "materialization_version": "LTMD_U1_VERTICAL_MATERIALIZATION_0.1",
  "privacy": {
    "object_identifiers_emitted": false,
    "ocr_text_emitted": false,
    "page_identifiers_emitted": false,
    "pair_identifiers_emitted": false,
    "source_hash_values_emitted": false
  },
  "provenance": {
    "human_validation_complete": false,
    "registry_sha256": "9a4f3b57c993b4ef86a821508bf050e3efd812f682b483862550dc977423d1c8",
    "reuse_similarity_sha256": "4c180f37b287f4c5cc81155aabd8a97e5feb6f40668c3baa296c4733f8063301",
    "universal_index_sha256": "aec55cc7dd83c2e1e22d26e3baf8f7ca2e35e32898827ec84e6222edd4bcf7a2"
  },
  "registry_version": "LTMD_U1_VERTICAL_REGISTRY_0.1",
  "result_state": "exploratory_signal",
  "scientific_state": {
    "aliases_created": false,
    "semantic_ready": false,
    "text_verified": false
  },
  "verticals": [
    {
      "breakdown_cardinality": {"generation": 11, "grade_code": 6, "wave": 11},
      "interpretation_boundary": "Describe ocurrencias léxicas asociadas con ciudadanía, democracia y derechos; no equivale a presencia curricular validada de educación cívica o derechos humanos.",
      "label_es": "Ciudadanía, democracia y derechos",
      "metrics": {"candidate_books": 193, "candidate_pages": 907, "candidate_pages_per_1000": 10.47961270494171, "corpus_books_in_scope": 492, "corpus_pages_in_scope": 86549},
      "probes": [
        {"label_es": "Democracia", "metrics": {"candidate_books": 107, "candidate_pages": 359, "candidate_pages_per_1000": 4.147939317611988, "corpus_books_in_scope": 492, "corpus_pages_in_scope": 86549}, "probe_id": "democracy"},
        {"label_es": "Ciudadanía", "metrics": {"candidate_books": 143, "candidate_pages": 402, "candidate_pages_per_1000": 4.644767703844065, "corpus_books_in_scope": 492, "corpus_pages_in_scope": 86549}, "probe_id": "citizenship"},
        {"label_es": "Derechos humanos", "metrics": {"candidate_books": 52, "candidate_pages": 272, "candidate_pages_per_1000": 3.1427283966308104, "corpus_books_in_scope": 492, "corpus_pages_in_scope": 86549}, "probe_id": "human_rights"}
      ],
      "reuse_context": {"candidate_pages_with_any_reuse_similarity_signal": 198, "candidate_pages_with_cross_generation_reuse_similarity_signal": 181, "share_candidate_pages_with_any_reuse_similarity_signal": 0.21830209481808158},
      "status": "materialized_exploratory",
      "vertical_id": "citizenship_democracy_rights"
    },
    {
      "breakdown_cardinality": {"generation": 11, "grade_code": 6, "wave": 11},
      "interpretation_boundary": "Describe señales léxicas sobre mujer, género y familia; no identifica por sí sola roles, estereotipos, igualdad, relaciones de género ni modelos familiares.",
      "label_es": "Mujeres, género y familia",
      "metrics": {"candidate_books": 475, "candidate_pages": 6569, "candidate_pages_per_1000": 75.89920160833748, "corpus_books_in_scope": 492, "corpus_pages_in_scope": 86549},
      "probes": [
        {"label_es": "Mujer/mujeres", "metrics": {"candidate_books": 380, "candidate_pages": 2523, "candidate_pages_per_1000": 29.151116708454172, "corpus_books_in_scope": 492, "corpus_pages_in_scope": 86549}, "probe_id": "women"},
        {"label_es": "Género", "metrics": {"candidate_books": 255, "candidate_pages": 704, "candidate_pages_per_1000": 8.134120555985627, "corpus_books_in_scope": 492, "corpus_pages_in_scope": 86549}, "probe_id": "gender"},
        {"label_es": "Familia", "metrics": {"candidate_books": 461, "candidate_pages": 3816, "candidate_pages_per_1000": 44.09063074096754, "corpus_books_in_scope": 492, "corpus_pages_in_scope": 86549}, "probe_id": "family"}
      ],
      "reuse_context": {"candidate_pages_with_any_reuse_similarity_signal": 1748, "candidate_pages_with_cross_generation_reuse_similarity_signal": 1461, "share_candidate_pages_with_any_reuse_similarity_signal": 0.266098340691125},
      "status": "materialized_exploratory",
      "vertical_id": "gender_women_family"
    },
    {
      "breakdown_cardinality": {"generation": 11, "grade_code": 6, "wave": 11},
      "interpretation_boundary": "Describe señales léxicas ambientales; no demuestra educación ambiental, enfoque ecológico ni valoración normativa de la naturaleza.",
      "label_es": "Medio ambiente y naturaleza",
      "metrics": {"candidate_books": 400, "candidate_pages": 2526, "candidate_pages_per_1000": 29.185779154005246, "corpus_books_in_scope": 492, "corpus_pages_in_scope": 86549},
      "probes": [
        {"label_es": "Medio ambiente", "metrics": {"candidate_books": 206, "candidate_pages": 427, "candidate_pages_per_1000": 4.933621416769691, "corpus_books_in_scope": 492, "corpus_pages_in_scope": 86549}, "probe_id": "environment_phrase"},
        {"label_es": "Naturaleza", "metrics": {"candidate_books": 359, "candidate_pages": 1887, "candidate_pages_per_1000": 21.802678251626247, "corpus_books_in_scope": 492, "corpus_pages_in_scope": 86549}, "probe_id": "nature"},
        {"label_es": "Ecología/ecológico", "metrics": {"candidate_books": 144, "candidate_pages": 308, "candidate_pages_per_1000": 3.5586777432437113, "corpus_books_in_scope": 492, "corpus_pages_in_scope": 86549}, "probe_id": "ecology"}
      ],
      "reuse_context": {"candidate_pages_with_any_reuse_similarity_signal": 541, "candidate_pages_with_cross_generation_reuse_similarity_signal": 478, "share_candidate_pages_with_any_reuse_similarity_signal": 0.21417260490894696},
      "status": "materialized_exploratory",
      "vertical_id": "environment_nature"
    },
    {
      "breakdown_cardinality": {"generation": 11, "grade_code": 6, "wave": 11},
      "interpretation_boundary": "Describe señales léxicas de migración y movilidad; no clasifica causas, direcciones, poblaciones, valoración social ni tratamiento histórico.",
      "label_es": "Migración y movilidad",
      "metrics": {"candidate_books": 134, "candidate_pages": 483, "candidate_pages_per_1000": 5.580653733723093, "corpus_books_in_scope": 492, "corpus_pages_in_scope": 86549},
      "probes": [
        {"label_es": "Migración", "metrics": {"candidate_books": 97, "candidate_pages": 289, "candidate_pages_per_1000": 3.339148921420236, "corpus_books_in_scope": 492, "corpus_pages_in_scope": 86549}, "probe_id": "migration"},
        {"label_es": "Migrante/migrantes", "metrics": {"candidate_books": 59, "candidate_pages": 152, "candidate_pages_per_1000": 1.7562305745878057, "corpus_books_in_scope": 492, "corpus_pages_in_scope": 86549}, "probe_id": "migrants"},
        {"label_es": "Inmigración/emigración", "metrics": {"candidate_books": 68, "candidate_pages": 144, "candidate_pages_per_1000": 1.6637973864516054, "corpus_books_in_scope": 492, "corpus_pages_in_scope": 86549}, "probe_id": "immigration_emigration"}
      ],
      "reuse_context": {"candidate_pages_with_any_reuse_similarity_signal": 51, "candidate_pages_with_cross_generation_reuse_similarity_signal": 51, "share_candidate_pages_with_any_reuse_similarity_signal": 0.10559006211180125},
      "status": "materialized_exploratory",
      "vertical_id": "migration_mobility"
    },
    {
      "breakdown_cardinality": {"generation": 11, "grade_code": 6, "wave": 11},
      "interpretation_boundary": "Describe ocurrencias léxicas sobre trabajo y economía; no equivale a una clasificación de modelos económicos, clases sociales, condiciones laborales ni educación financiera.",
      "label_es": "Trabajo y economía",
      "metrics": {"candidate_books": 473, "candidate_pages": 8559, "candidate_pages_per_1000": 98.89195715721729, "corpus_books_in_scope": 492, "corpus_pages_in_scope": 86549},
      "probes": [
        {"label_es": "Trabajo", "metrics": {"candidate_books": 470, "candidate_pages": 7246, "candidate_pages_per_1000": 83.72136015436342, "corpus_books_in_scope": 492, "corpus_pages_in_scope": 86549}, "probe_id": "work"},
        {"label_es": "Trabajador/trabajadora", "metrics": {"candidate_books": 142, "candidate_pages": 242, "candidate_pages_per_1000": 2.796103941120059, "corpus_books_in_scope": 492, "corpus_pages_in_scope": 86549}, "probe_id": "workers"},
        {"label_es": "Economía/empleo", "metrics": {"candidate_books": 265, "candidate_pages": 1454, "candidate_pages_per_1000": 16.799731943754406, "corpus_books_in_scope": 492, "corpus_pages_in_scope": 86549}, "probe_id": "economy_employment"}
      ],
      "reuse_context": {"candidate_pages_with_any_reuse_similarity_signal": 2318, "candidate_pages_with_cross_generation_reuse_similarity_signal": 2095, "share_candidate_pages_with_any_reuse_similarity_signal": 0.27082603107839703},
      "status": "materialized_exploratory",
      "vertical_id": "work_economy"
    },
    {
      "breakdown_cardinality": {"generation": 11, "grade_code": 6, "wave": 11},
      "interpretation_boundary": "Describe señales léxicas; no identifica modelos de discapacidad, prácticas inclusivas, ajustes razonables ni calidad del tratamiento pedagógico.",
      "label_es": "Discapacidad e inclusión",
      "metrics": {"candidate_books": 54, "candidate_pages": 150, "candidate_pages_per_1000": 1.7331222775537558, "corpus_books_in_scope": 492, "corpus_pages_in_scope": 86549},
      "probes": [
        {"label_es": "Discapacidad", "metrics": {"candidate_books": 38, "candidate_pages": 95, "candidate_pages_per_1000": 1.0976441091173785, "corpus_books_in_scope": 492, "corpus_pages_in_scope": 86549}, "probe_id": "disability"},
        {"label_es": "Inclusión/inclusivo", "metrics": {"candidate_books": 28, "candidate_pages": 56, "candidate_pages_per_1000": 0.6470323169534021, "corpus_books_in_scope": 492, "corpus_pages_in_scope": 86549}, "probe_id": "inclusion"}
      ],